<?xml version="1.0" encoding="UTF-8"?>
<!--
  ~ Copyright (c) 2020 FORS Development Center
  ~ Trifonovskiy tup. 3, Moscow, 129272, Russian Federation
  ~ All rights reserved.
  ~
  ~ This software is the confidential and proprietary information of
  ~ FORS Development Center ("Confidential Information"). You shall not
  ~ disclose such Confidential Information and shall use it only in
  ~ accordance with the terms of the license agreement you entered into
  ~ with FORS.
  -->

<xs:schema xmlns="http://javaops.ru"
           xmlns:xs="http://www.w3.org/2001/XMLSchema"
           targetNamespace="http://javaops.ru"
           elementFormDefault="qualified" attributeFormDefault="unqualified">

    <xs:element name="Payload">
        <xs:complexType>
            <xs:all>
                <xs:element name="Cities">
                    <xs:complexType>
                        <xs:sequence minOccurs="1" maxOccurs="unbounded">
                            <xs:element ref="City"/>
                        </xs:sequence>
                    </xs:complexType>
                </xs:element>
                <xs:element name="Users">
                    <xs:complexType>
                        <xs:sequence minOccurs="0" maxOccurs="unbounded">
                            <xs:element ref="User"/>
                        </xs:sequence>
                    </xs:complexType>
                </xs:element>
            </xs:all>
        </xs:complexType>
    </xs:element>

    <xs:element name="User">
        <xs:complexType>
            <xs:sequence>
                <xs:element type="xs:string" name="email"/>
                <xs:element type="xs:string" name="fullName"/>
            </xs:sequence>
            <xs:attribute type="flagType" name="flag" use="required"/>
            <xs:attribute type="xs:IDREF" name="city" use="required"/>
        </xs:complexType>
    </xs:element>

    <xs:simpleType name="flagType">
        <xs:restriction base="xs:string">
            <xs:enumeration value="active"/>
            <xs:enumeration value="deleted"/>
            <xs:enumeration value="superuser"/>
        </xs:restriction>
    </xs:simpleType>

    <xs:element name="City" type="cityType"/>

    <xs:complexType name="cityType">
        <xs:simpleContent>
            <xs:extension base="xs:string">
                <xs:attribute type="xs:ID" name="id" use="required"/>
            </xs:extension>
        </xs:simpleContent>
    </xs:complexType>
</xs:schema>